{
  "schema_version": "validation-state-snapshot-v1",
  "snapshot_id": "sp004-s024-validation-baseline-2026-09-05",
  "parent_snapshot": null,
  "baseline_revision": "f93e82c87df36a33f5fe4b74beae85a45a02f03a",
  "git_observed_facts": {
    "repo": "/Users/xiaomei/Documents/projects/sge-governance-skill",
    "worktree": ".",
    "git_common_dir": ".git",
    "baseline_commit": "f93e82c87df36a33f5fe4b74beae85a45a02f03a",
    "dirty_state_digest": "498c76b52bc66df52b4b79cba24fe4d620ad59a810b889425779f7af2426e88a",
    "tracked_changed": [
      {"path":"README.md","sha256":"e46f93164d18b7140daec4e2b688b3c83ba0e25db66b818f12a6744ca007d26f","status":"modified","kind":"tracked"},
      {"path":"docs/Quick_Start_CN.md","sha256":"d33dd3449756e3e17bab04e1de2832e47f0d5f3e2084a81d24033fe96e80ca3e","status":"modified","kind":"tracked"},
      {"path":"public_export_manifest_v1.json","sha256":"228b28ec802553421b2d590ae289ce4c3609e18afa0a4b0a29b841fc228d5ece","status":"modified","kind":"tracked"},
      {"path":"tools/sge_public.py","sha256":"1852bd84facb06802476d9872e1afc1fa67f725248a64ac4410abd795bf7427f","status":"modified","kind":"tracked"},
      {"path":"Dashboard/tools/doctor.py","sha256":"42ec986002a350ccb23abf18cdb4a50fe8ac24d64080ca575d351c979a59c505","status":"modified","kind":"tracked"},
      {"path":".codex/skills/sge-governed-checkpoints/scripts/context_efficiency_pilot.py","sha256":"78dc6a10010b155c60d7d0551bc8cb84e078da1e0de0099a71eeec753df73c20","status":"modified","kind":"tracked"},
      {"path":"tests/test_public_candidate.py","sha256":"77a6ed0d716ee98a74a94b17489dd8ec15bad45cc88983cd3c79b47b93de13dd","status":"modified","kind":"tracked"},
      {"path":"tests/test_public_projection.py","sha256":"db9858ed3fec9531d083bbc8031cf50d38bfc66baca2f6bf326d0b8eb3bd8f92","status":"modified","kind":"tracked"},
      {"path":"tests/test_repository_quality.py","sha256":"51bef5a01a69471554c88f52b454feced1a57136eca271daf81200cb74778b53","status":"modified","kind":"tracked"}
    ],
    "untracked": [
      {"path":"tests/bdd/readable_cards/sp004/identity-locator-residue.md","sha256":"45ab23dd43a98475773850e42419d6d35fd66a074a87a9c0308e5f3cc5899c2d","status":"untracked","kind":"untracked"},
      {"path":"Dashboard/Artifacts/Stage-Plan-SP-004/SP004_S023_Contract.json","sha256":"da0d15e9ef0a2ee1dc4bbdc5cf2137e3da8757251a6a9a07c3595ce1cf42a8b2","status":"untracked","kind":"untracked"},
      {"path":"Dashboard/Artifacts/Stage-Plan-SP-004/SP004_S023_Cases.json","sha256":"4ffb3b1a23071238295184bee5567945ec3d4ec2ca6ea33b41bb584428262fb3","status":"untracked","kind":"untracked"},
      {"path":"Dashboard/Artifacts/Stage-Plan-SP-004/SP004_S024_BuilderLaneTaskCard.json","sha256":"d8b3f8fda37ff84fd7a8d40b9353dde3d42e1fb300742a3d509140df9cb91314","status":"untracked","kind":"untracked"},
      {"path":"Dashboard/Artifacts/Stage-Plan-SP-004/SP004_S024_ValidationLaneTaskCard.json","sha256":"0faffa390b9490c66ef3d542bd7a870123f0fc5b709246742968300ce9531fae","status":"untracked","kind":"untracked"}
    ],
    "renamed": []
  },
  "semantic_declarations": {
    "user_instruction":{"ref":"SP004_S024_ValidationLaneTaskCard.json","revision":"card-v1","sha256":"0faffa390b9490c66ef3d542bd7a870123f0fc5b709246742968300ce9531fae"},
    "goal":{"ref":"SP004_SemxResidueOpenSourceGaps_LoopGoal.md","revision":"current-checkout","sha256":"f7e55d3e1cb0d8284d8be9e16534fae34d75ac863fcb410430847f4dfbd11a08"},
    "governance":{"ref":"AGENTS.md","revision":"current-checkout","sha256":"1362597c1fa59259b09004f7b52aebb4a485eab7c6ac944596d124e0827ed6a5"},
    "acceptance_criteria":{"ref":"SP004_S023_Contract.json#finding_contracts","revision":"frozen","sha256":"da0d15e9ef0a2ee1dc4bbdc5cf2137e3da8757251a6a9a07c3595ce1cf42a8b2"},
    "original_objective":{"ref":"SP004_SemxResidueOpenSourceGaps_LoopGoal.md#原始-Must-have-Ledger","revision":"current-checkout","sha256":"f7e55d3e1cb0d8284d8be9e16534fae34d75ac863fcb410430847f4dfbd11a08"},
    "claim_ceiling":{"ref":"SP004_S023_Contract.json#claim_ceiling","revision":"contract-frozen","sha256":"da0d15e9ef0a2ee1dc4bbdc5cf2137e3da8757251a6a9a07c3595ce1cf42a8b2"},
    "approval_authority":{"ref":"SP004_S023_Contract.json#write_exclusions","revision":"contract-frozen","sha256":"da0d15e9ef0a2ee1dc4bbdc5cf2137e3da8757251a6a9a07c3595ce1cf42a8b2"},
    "truth_placement":{"ref":"AGENTS.md#Source-Of-Truth-Split","revision":"current-checkout","sha256":"1362597c1fa59259b09004f7b52aebb4a485eab7c6ac944596d124e0827ed6a5"},
    "dependency":{"ref":"SP004_S024_BuilderLaneTaskCard.json#write_scope","revision":"builder-baseline","sha256":"d8b3f8fda37ff84fd7a8d40b9353dde3d42e1fb300742a3d509140df9cb91314"},
    "execution_topology":{"ref":"SP004_S024_ValidationLaneTaskCard.json#topology","revision":"current-checkout","sha256":"0faffa390b9490c66ef3d542bd7a870123f0fc5b709246742968300ce9531fae"},
    "threat_model":{"ref":"SP004_S023_Contract.json#failure_taxonomy","revision":"frozen","sha256":"da0d15e9ef0a2ee1dc4bbdc5cf2137e3da8757251a6a9a07c3595ce1cf42a8b2"},
    "semantic_risk":{"ref":"SP004_S024_ValidationReview.md#阻断发现","revision":"validation-baseline","sha256":"a6fa5a84fd0c66e5b6f33265cc763c0396d4c8afb87028b6a284914009cb9351"},
    "patch_consistency":{"ref":"SP004_S024_BuilderLaneTaskCard.json#delta_read_set","revision":"builder-baseline","sha256":"d8b3f8fda37ff84fd7a8d40b9353dde3d42e1fb300742a3d509140df9cb91314"}
  },
  "generated_registry":{"registry_id":"dashboard-session-registry-v1","revision":"current-checkout","complete":true,"surfaces":[{"path":"Dashboard/Sessions.md","sha256":"3f79dc89f20953bfcd949ac0d9e2ede834b0c7b017c219b27d618563d08c9bbb"},{"path":"Dashboard/Session_Index.md","sha256":"956f229602a23d93c9e00f7484f9fb8c86c64536e6ba241255bf72fa6197d94c"}],"registry_digest":"1e1ead800023857fc17af5b333ae09fa568480cd5a95660a46447f071dd08741"},
  "critical_file_hashes":{"Dashboard/Artifacts/Stage-Plan-SP-004/SP004_S023_Contract.json":"da0d15e9ef0a2ee1dc4bbdc5cf2137e3da8757251a6a9a07c3595ce1cf42a8b2","Dashboard/Artifacts/Stage-Plan-SP-004/SP004_S023_Cases.json":"4ffb3b1a23071238295184bee5567945ec3d4ec2ca6ea33b41bb584428262fb3","public_export_manifest_v1.json":"228b28ec802553421b2d590ae289ce4c3609e18afa0a4b0a29b841fc228d5ece","Dashboard/tools/doctor.py":"42ec986002a350ccb23abf18cdb4a50fe8ac24d64080ca575d351c979a59c505","tools/sge_public.py":"1852bd84facb06802476d9872e1afc1fa67f725248a64ac4410abd795bf7427f"},
  "validated_scope":["S-024 Builder diff","GAP-MH-01","GAP-MH-02","GAP-MH-07","GAP-MH-08","GAP-MH-09","GAP-MH-10","public export/verify/doctor","repository doctor","Quick Start","SP-041 project neutrality","Semx/history isolation","frozen S-023 identity binding"],
  "known_blockers":["locator gate does not enforce typed disposition or Dashboard/Artifacts coverage","residue gate does not enforce semx deny-token preservation","trusted frozen RED/GREEN execution evidence not durable/present","S-025/S-026/S-027/S-028/S-029 not complete"],
  "affected_gates":["public_identity","public_provenance_locators","public_residue","Quick Start fence test","repository doctor","SGC SI-1..SI-6"],
  "last_verdict":"partial_blocked",
  "reviewer_source":"Dashboard/Artifacts/Stage-Plan-SP-004/SP004_S024_ValidationReview.md",
  "created_at":"2026-09-04T23:59:00-07:00",
  "reopen_triggers":["Builder changes frozen Contract/Cases/expected/RED evidence/claim ceiling","any changed file outside declared delta read set","locator or residue gate implementation changes","new S-024 durable RED/GREEN evidence","Dashboard/KB final state changes","closeout or post-closeout reconciliation is introduced"],
  "collection_issues":["No remote/rights/release evidence collected by authorization boundary","S-023 Cases explicitly say this lane does not execute cases; ordinary unittest is not ERBE execution evidence","semantic_risk sha256 is null because the declaration points to this newly written review"]
}
